{
  "version": 1,
  "sport": "nba",
  "checklist_id": "2025-26-topps-chrome-x-cactus-jack-basketball-checklist",
  "product_label": "2025-26 Topps Chrome X Cactus Jack Basketball",
  "source": "Topps odds sheet PDF",
  "configs": [
    {
      "key": "hobby",
      "label": "Hobby",
      "channel": "hobby",
      "group": "hobby"
    }
  ],
  "rows": [
    { "label": "Base", "set": "Base", "parallel": "", "odds": { "hobby": 1 } },
    { "label": "Base White", "set": "Base", "parallel": "White", "odds": { "hobby": 7 } },
    { "label": "Base Refractor", "set": "Base", "parallel": "Refractor", "odds": { "hobby": 10 } },
    { "label": "Base LogoFractor", "set": "Base", "parallel": "LogoFractor", "odds": { "hobby": 20 } },
    { "label": "Base Teal Speckle Refractor", "set": "Base", "parallel": "Teal Speckle Refractor", "odds": { "hobby": 26 } },
    { "label": "Base Pink Refractor", "set": "Base", "parallel": "Pink Refractor", "odds": { "hobby": 31 } },
    { "label": "Base Aqua Shimmer", "set": "Base", "parallel": "Aqua Shimmer", "odds": { "hobby": 38 } },
    { "label": "Base Lasers", "set": "Base", "parallel": "Lasers", "odds": { "hobby": 44 } },
    { "label": "Base Blue Refractor", "set": "Base", "parallel": "Blue Refractor", "odds": { "hobby": 51 } },
    { "label": "Base Sonar", "set": "Base", "parallel": "Sonar", "odds": { "hobby": 61 } },
    { "label": "Base Green Refractor", "set": "Base", "parallel": "Green Refractor", "odds": { "hobby": 77 } },
    { "label": "Base Purple Mini-Diamond", "set": "Base", "parallel": "Purple Mini-Diamond", "odds": { "hobby": 101 } },
    { "label": "Base Gold Refractor", "set": "Base", "parallel": "Gold Refractor", "odds": { "hobby": 151 } },
    { "label": "Base Cactus Jack Refractor", "set": "Base", "parallel": "Cactus Jack Refractor", "odds": { "hobby": 184 } },
    { "label": "Base Orange Refractor", "set": "Base", "parallel": "Orange Refractor", "odds": { "hobby": 302 } },
    { "label": "Base Black Refractor", "set": "Base", "parallel": "Black Refractor", "odds": { "hobby": 754 } },
    { "label": "Base Red Refractor", "set": "Base", "parallel": "Red Refractor", "odds": { "hobby": 1509 } },
    { "label": "Base Red Mini-Diamond Refractor", "set": "Base", "parallel": "Red Mini-Diamond Refractor", "odds": { "hobby": 1509 } },
    { "label": "Base SuperFractor", "set": "Base", "parallel": "SuperFractor", "odds": { "hobby": 7575 } },
    { "label": "Utopia Highlights", "set": "Utopia Highlights", "parallel": "", "odds": { "hobby": 8 } },
    { "label": "Jacked Up", "set": "Jacked Up", "parallel": "", "odds": { "hobby": 8 } },
    { "label": "LA Flame Legends", "set": "La Flame Legends", "parallel": "", "odds": { "hobby": 15 } },
    { "label": "Utopia Highlights Blue Refractor", "set": "Utopia Highlights", "parallel": "Blue Refractor", "odds": { "hobby": 126 } },
    { "label": "Jacked Up Blue Refractor", "set": "Jacked Up", "parallel": "Blue Refractor", "odds": { "hobby": 126 } },
    { "label": "LA Flame Legends Blue Refractor", "set": "La Flame Legends", "parallel": "Blue Refractor", "odds": { "hobby": 252 } },
    { "label": "Utopia Highlights Green Refractor", "set": "Utopia Highlights", "parallel": "Green Refractor", "odds": { "hobby": 191 } },
    { "label": "Jacked Up Green Refractor", "set": "Jacked Up", "parallel": "Green Refractor", "odds": { "hobby": 191 } },
    { "label": "LA Flame Legends Green Refractor", "set": "La Flame Legends", "parallel": "Green Refractor", "odds": { "hobby": 381 } },
    { "label": "Utopia Highlights Purple Mini-Diamond", "set": "Utopia Highlights", "parallel": "Purple Mini-Diamond", "odds": { "hobby": 252 } },
    { "label": "Jacked Up Purple Mini-Diamond", "set": "Jacked Up", "parallel": "Purple Mini-Diamond", "odds": { "hobby": 252 } },
    { "label": "LA Flame Legends Purple Mini-Diamond", "set": "La Flame Legends", "parallel": "Purple Mini-Diamond", "odds": { "hobby": 503 } },
    { "label": "Utopia Highlights Gold Refractor", "set": "Utopia Highlights", "parallel": "Gold Refractor", "odds": { "hobby": 377 } },
    { "label": "Jacked Up Gold Refractor", "set": "Jacked Up", "parallel": "Gold Refractor", "odds": { "hobby": 377 } },
    { "label": "LA Flame Legends Gold Refractor", "set": "La Flame Legends", "parallel": "Gold Refractor", "odds": { "hobby": 754 } },
    { "label": "Utopia Highlights Orange Refractor", "set": "Utopia Highlights", "parallel": "Orange Refractor", "odds": { "hobby": 754 } },
    { "label": "Jacked Up Orange Refractor", "set": "Jacked Up", "parallel": "Orange Refractor", "odds": { "hobby": 754 } },
    { "label": "LA Flame Legends Orange Refractor", "set": "La Flame Legends", "parallel": "Orange Refractor", "odds": { "hobby": 1509 } },
    { "label": "Utopia Highlights Black Refractor", "set": "Utopia Highlights", "parallel": "Black Refractor", "odds": { "hobby": 1884 } },
    { "label": "Jacked Up Black Refractor", "set": "Jacked Up", "parallel": "Black Refractor", "odds": { "hobby": 1884 } },
    { "label": "LA Flame Legends Black Refractor", "set": "La Flame Legends", "parallel": "Black Refractor", "odds": { "hobby": 3768 } },
    { "label": "Utopia Highlights Red Refractor", "set": "Utopia Highlights", "parallel": "Red Refractor", "odds": { "hobby": 3768 } },
    { "label": "Jacked Up Red Refractor", "set": "Jacked Up", "parallel": "Red Refractor", "odds": { "hobby": 3768 } },
    { "label": "LA Flame Legends Red Refractor", "set": "La Flame Legends", "parallel": "Red Refractor", "odds": { "hobby": 7575 } },
    { "label": "Utopia Highlights SuperFractor", "set": "Utopia Highlights", "parallel": "SuperFractor", "odds": { "hobby": 19137 } },
    { "label": "Jacked Up SuperFractor", "set": "Jacked Up", "parallel": "SuperFractor", "odds": { "hobby": 19137 } },
    { "label": "LA Flame Legends SuperFractor", "set": "La Flame Legends", "parallel": "SuperFractor", "odds": { "hobby": 38274 } },
    { "label": "Astrovision", "set": "Astrovision", "parallel": "", "odds": { "hobby": 305 } },
    { "label": "Cactus Mode", "set": "Cactus Mode", "parallel": "", "odds": { "hobby": 1200 } },
    { "label": "Astrovision SuperFractor", "set": "Astrovision", "parallel": "SuperFractor", "odds": { "hobby": 42777 } },
    { "label": "Cactus Mode SuperFractor", "set": "Cactus Mode", "parallel": "SuperFractor", "odds": { "hobby": 42777 } },
    { "label": "Base Autograph Variation", "set": "Base Autographs", "parallel": "Variation", "odds": { "hobby": 208 } },
    { "label": "Cactus Ink", "set": "Cactus Ink", "parallel": "", "odds": { "hobby": 208 } },
    { "label": "Base Autograph Variation Orange Refractor", "set": "Base Autographs", "parallel": "Variation Orange Refractor", "odds": { "hobby": 1064 } },
    { "label": "Cactus Ink Orange Refractor", "set": "Cactus Ink", "parallel": "Orange Refractor", "odds": { "hobby": 1064 } },
    { "label": "Base Autograph Variation Black Refractor", "set": "Base Autographs", "parallel": "Variation Black Refractor", "odds": { "hobby": 2664 } },
    { "label": "Cactus Ink Black Refractor", "set": "Cactus Ink", "parallel": "Black Refractor", "odds": { "hobby": 2664 } },
    { "label": "Base Autograph Variation Red Refractor", "set": "Base Autographs", "parallel": "Variation Red Refractor", "odds": { "hobby": 5348 } },
    { "label": "Cactus Ink Red Refractor", "set": "Cactus Ink", "parallel": "Red Refractor", "odds": { "hobby": 5348 } },
    { "label": "Base Autograph Variation SuperFractor", "set": "Base Autographs", "parallel": "Variation SuperFractor", "odds": { "hobby": 26934 } },
    { "label": "Cactus Ink SuperFractor", "set": "Cactus Ink", "parallel": "SuperFractor", "odds": { "hobby": 26934 } }
  ]
}
